{"schemaVersion":1,"version":2,"generatedAt":"2026-10-18T11:22:07.308Z","profileRevision":"registry-2","sources":{"openai":{"title":"OpenAI · Prompt engineering","url":"https://developers.openai.com/api/docs/guides/prompt-engineering"},"reasoning":{"title":"OpenAI · Reasoning best practices","url":"https://developers.openai.com/api/docs/guides/reasoning-best-practices"},"gpt6":{"title":"OpenAI · GPT-6 prompting","url":"https://developers.openai.com/api/docs/guides/latest-model/gpt-6-astra#prompting-best-practices"},"gpt41":{"title":"OpenAI · GPT-4.1 Prompting Guide","url":"https://developers.openai.com/cookbook/examples/gpt4-1_prompting_guide"},"gemini":{"title":"Google · Prompt design strategies","url":"https://ai.google.dev/gemini-api/docs/prompting-strategies"},"claude":{"title":"Anthropic · Prompting best practices","url":"https://platform.claude.com/docs/en/build-with-claude/prompt-engineering/claude-prompting-best-practices"},"opus55":{"title":"Anthropic · Opus 5.5","url":"https://platform.claude.com/docs/en/build-with-claude/prompt-engineering/prompting-claude-opus-5-5"},"sonnet55":{"title":"Anthropic · Sonnet 5.5","url":"https://platform.claude.com/docs/en/build-with-claude/prompt-engineering/prompting-claude-sonnet-5-5"},"haiku55":{"title":"Anthropic · Haiku 5.5","url":"https://platform.claude.com/docs/en/build-with-claude/prompt-engineering/prompting-claude-haiku-5-5"},"fable51":{"title":"Anthropic · Fable 5.1","url":"https://platform.claude.com/docs/en/build-with-claude/prompt-engineering/prompting-claude-fable-5-1"}},"models":[{"id":"general","brand":"chatgpt","provider":"openai","displayName":"모델 모름 / 브랜드 공통","family":null,"releaseDate":null,"capabilities":null,"contextWindow":null,"profileId":"chatgpt:general","profileVersion":1,"candidateProfileId":null,"aliases":[],"availability":"unknown","webAvailability":"unknown","lifecycle":"unknown","sourceRefs":["openai"],"firstSeen":"2026-10-18T00:00:00.000Z","lastUpdated":"2026-10-18T00:00:00.000Z","isNew":false,"observations":[]},{"id":"gpt-6-astra","brand":"chatgpt","provider":"openai","displayName":"GPT-6 Astra","family":"gpt6","releaseDate":null,"capabilities":null,"contextWindow":null,"profileId":"chatgpt:gpt-6-astra","profileVersion":1,"candidateProfileId":null,"aliases":[],"availability":"unknown","webAvailability":"unknown","lifecycle":"unknown","sourceRefs":["gpt6","reasoning"],"firstSeen":"2026-10-18T00:00:00.000Z","lastUpdated":"2026-10-18T00:00:00.000Z","isNew":false,"observations":[]},{"id":"gpt-6.1-sol","brand":"chatgpt","provider":"openai","displayName":"GPT-6.1 Sol","family":"gpt6","releaseDate":null,"capabilities":null,"contextWindow":null,"profileId":"chatgpt:gpt-6.1-sol","profileVersion":1,"candidateProfileId":null,"aliases":[],"availability":"unknown","webAvailability":"unknown","lifecycle":"unknown","sourceRefs":["gpt6","reasoning"],"firstSeen":"2026-10-18T00:00:00.000Z","lastUpdated":"2026-10-18T00:00:00.000Z","isNew":false,"observations":[]},{"id":"gpt-6-luna","brand":"chatgpt","provider":"openai","displayName":"GPT-6 Luna","family":"gpt6","releaseDate":null,"capabilities":null,"contextWindow":null,"profileId":"chatgpt:gpt-6-luna","profileVersion":1,"candidateProfileId":null,"aliases":[],"availability":"unknown","webAvailability":"unknown","lifecycle":"unknown","sourceRefs":["gpt6","reasoning"],"firstSeen":"2026-10-18T00:00:00.000Z","lastUpdated":"2026-10-18T00:00:00.000Z","isNew":false,"observations":[]},{"id":"gpt-5.5","brand":"chatgpt","provider":"openai","displayName":"GPT-5.5","family":"reasoning","releaseDate":null,"capabilities":null,"contextWindow":null,"profileId":"chatgpt:gpt-5.5","profileVersion":1,"candidateProfileId":null,"aliases":[],"availability":"unknown","webAvailability":"unknown","lifecycle":"unknown","sourceRefs":["reasoning","openai"],"firstSeen":"2026-10-18T00:00:00.000Z","lastUpdated":"2026-10-18T00:00:00.000Z","isNew":false,"observations":[]},{"id":"gpt-5.4","brand":"chatgpt","provider":"openai","displayName":"GPT-5.4","family":"reasoning","releaseDate":null,"capabilities":null,"contextWindow":null,"profileId":"chatgpt:gpt-5.4","profileVersion":1,"candidateProfileId":null,"aliases":[],"availability":"unknown","webAvailability":"unknown","lifecycle":"unknown","sourceRefs":["reasoning","openai"],"firstSeen":"2026-10-18T00:00:00.000Z","lastUpdated":"2026-10-18T00:00:00.000Z","isNew":false,"observations":[]},{"id":"gpt-5.4-mini","brand":"chatgpt","provider":"openai","displayName":"GPT-5.4-mini","family":"reasoning","releaseDate":null,"capabilities":null,"contextWindow":null,"profileId":"chatgpt:gpt-5.4-mini","profileVersion":1,"candidateProfileId":null,"aliases":[],"availability":"unknown","webAvailability":"unknown","lifecycle":"unknown","sourceRefs":["reasoning","openai"],"firstSeen":"2026-10-18T00:00:00.000Z","lastUpdated":"2026-10-18T00:00:00.000Z","isNew":false,"observations":[]},{"id":"gpt-5.4-nano","brand":"chatgpt","provider":"openai","displayName":"GPT-5.4-nano","family":"reasoning","releaseDate":null,"capabilities":null,"contextWindow":null,"profileId":"chatgpt:gpt-5.4-nano","profileVersion":1,"candidateProfileId":null,"aliases":[],"availability":"unknown","webAvailability":"unknown","lifecycle":"unknown","sourceRefs":["reasoning","openai"],"firstSeen":"2026-10-18T00:00:00.000Z","lastUpdated":"2026-10-18T00:00:00.000Z","isNew":false,"observations":[]},{"id":"gpt-5.2","brand":"chatgpt","provider":"openai","displayName":"GPT-5.2","family":"reasoning","releaseDate":null,"capabilities":null,"contextWindow":null,"profileId":"chatgpt:gpt-5.2","profileVersion":1,"candidateProfileId":null,"aliases":[],"availability":"unknown","webAvailability":"unknown","lifecycle":"unknown","sourceRefs":["reasoning","openai"],"firstSeen":"2026-10-18T00:00:00.000Z","lastUpdated":"2026-10-18T00:00:00.000Z","isNew":false,"observations":[]},{"id":"gpt-5.1","brand":"chatgpt","provider":"openai","displayName":"GPT-5.1","family":"reasoning","releaseDate":null,"capabilities":null,"contextWindow":null,"profileId":"chatgpt:gpt-5.1","profileVersion":1,"candidateProfileId":null,"aliases":[],"availability":"unknown","webAvailability":"unknown","lifecycle":"unknown","sourceRefs":["reasoning","openai"],"firstSeen":"2026-10-18T00:00:00.000Z","lastUpdated":"2026-10-18T00:00:00.000Z","isNew":false,"observations":[]},{"id":"gpt-5","brand":"chatgpt","provider":"openai","displayName":"GPT-5","family":"reasoning","releaseDate":null,"capabilities":null,"contextWindow":null,"profileId":"chatgpt:gpt-5","profileVersion":1,"candidateProfileId":null,"aliases":[],"availability":"unknown","webAvailability":"unknown","lifecycle":"unknown","sourceRefs":["reasoning","openai"],"firstSeen":"2026-10-18T00:00:00.000Z","lastUpdated":"2026-10-18T00:00:00.000Z","isNew":false,"observations":[]},{"id":"gpt-5-mini","brand":"chatgpt","provider":"openai","displayName":"GPT-5-mini","family":"reasoning","releaseDate":null,"capabilities":null,"contextWindow":null,"profileId":"chatgpt:gpt-5-mini","profileVersion":1,"candidateProfileId":null,"aliases":[],"availability":"unknown","webAvailability":"unknown","lifecycle":"unknown","sourceRefs":["reasoning","openai"],"firstSeen":"2026-10-18T00:00:00.000Z","lastUpdated":"2026-10-18T00:00:00.000Z","isNew":false,"observations":[]},{"id":"gpt-5-nano","brand":"chatgpt","provider":"openai","displayName":"GPT-5-nano","family":"reasoning","releaseDate":null,"capabilities":null,"contextWindow":null,"profileId":"chatgpt:gpt-5-nano","profileVersion":1,"candidateProfileId":null,"aliases":[],"availability":"unknown","webAvailability":"unknown","lifecycle":"unknown","sourceRefs":["reasoning","openai"],"firstSeen":"2026-10-18T00:00:00.000Z","lastUpdated":"2026-10-18T00:00:00.000Z","isNew":false,"observations":[]},{"id":"o3","brand":"chatgpt","provider":"openai","displayName":"o3","family":"reasoning","releaseDate":null,"capabilities":null,"contextWindow":null,"profileId":"chatgpt:o3","profileVersion":1,"candidateProfileId":null,"aliases":[],"availability":"unknown","webAvailability":"unknown","lifecycle":"unknown","sourceRefs":["reasoning"],"firstSeen":"2026-10-18T00:00:00.000Z","lastUpdated":"2026-10-18T00:00:00.000Z","isNew":false,"observations":[]},{"id":"o4-mini","brand":"chatgpt","provider":"openai","displayName":"o4-mini","family":"reasoning","releaseDate":null,"capabilities":null,"contextWindow":null,"profileId":"chatgpt:o4-mini","profileVersion":1,"candidateProfileId":null,"aliases":[],"availability":"unknown","webAvailability":"unknown","lifecycle":"unknown","sourceRefs":["reasoning"],"firstSeen":"2026-10-18T00:00:00.000Z","lastUpdated":"2026-10-18T00:00:00.000Z","isNew":false,"observations":[]},{"id":"gpt-4.1","brand":"chatgpt","provider":"openai","displayName":"GPT-4.1","family":"gpt41","releaseDate":null,"capabilities":null,"contextWindow":null,"profileId":"chatgpt:gpt-4.1","profileVersion":1,"candidateProfileId":null,"aliases":[],"availability":"unknown","webAvailability":"unknown","lifecycle":"unknown","sourceRefs":["gpt41"],"firstSeen":"2026-10-18T00:00:00.000Z","lastUpdated":"2026-10-18T00:00:00.000Z","isNew":false,"observations":[]},{"id":"gpt-4.1-mini","brand":"chatgpt","provider":"openai","displayName":"GPT-4.1-mini","family":"gpt41","releaseDate":null,"capabilities":null,"contextWindow":null,"profileId":"chatgpt:gpt-4.1-mini","profileVersion":1,"candidateProfileId":null,"aliases":[],"availability":"unknown","webAvailability":"unknown","lifecycle":"unknown","sourceRefs":["gpt41"],"firstSeen":"2026-10-18T00:00:00.000Z","lastUpdated":"2026-10-18T00:00:00.000Z","isNew":false,"observations":[]},{"id":"gpt-4.1-nano","brand":"chatgpt","provider":"openai","displayName":"GPT-4.1-nano","family":"gpt41","releaseDate":null,"capabilities":null,"contextWindow":null,"profileId":"chatgpt:gpt-4.1-nano","profileVersion":1,"candidateProfileId":null,"aliases":[],"availability":"unknown","webAvailability":"unknown","lifecycle":"unknown","sourceRefs":["gpt41"],"firstSeen":"2026-10-18T00:00:00.000Z","lastUpdated":"2026-10-18T00:00:00.000Z","i